ID_participant_long,transcript_coder1_coder2_coder3,transcript_wav2vec_base,transcript_wav2vec_large,transcript_google,transcript_whisper,transcript_whisper_medium,transcript_nvidia_xxlarge
most_important_problem_62b9b95e108fbc4df78a2956,"The most important problem is the political divide, and the fact that the two sides just getting further and further apart becoming more polarized, and this two-party system has already led to one civil war.",This important problem is the political divide the fact that the two sides just going further and further apart becoming more polarized and thus two party system has already led to one Civil War,The most important problem is the political divide and the fact that the two sides just getting further and further apart becoming more polarized and this two party system has already led to one Civil War,miss important problem is the political divide in the fact that the two sides just getting further and further apart becoming more polarized and those two party system has already led to one Civil War,"The most important problem is the political divide and the fact that the two sides are just getting further and further apart, becoming more polarized, and this two-party system has already led to one civil war.",The most important problem is the political divide and the fact that the two sides just getting further and further apart becoming more polarized. And this two party system has already led to one civil war.,the most important problem is the political divide and the fact that the two sides are just getting further and further apart becoming more polarized and this two party system has already led to one civil war
most_important_problem_6361547de0e158654a2a2c5d,It is I think it is obvious but guns is the main problem in this country. The easily access to guns gun fight gun killing is getting worse than worse every year.,It is I think it is Obious Butte Gans is the the Demain problem in this country the Eciliaxis to Gans am Gan Fi Amgan Kilin is getting worse and worse every year,It is I think it is obvious but guns Isthe the main problem in this country the Easiy access to guns an gun fight an gun killing is getting worse and worse every year,it is I think it is obvious by the guns is the the main problem in this country is celiacs to guns guns fire gun killing is getting worse and worse every year,"I think it is obvious, but guns is the main problem in this country. The easily access to guns, gun fight, gun killing is getting worse and worse every year.","I think it is obvious, but guns is the main problem in this country. The easily access to guns, gun fight, gun killing is getting worse and worse every year.",it is i think it is obvious but uh guns is the the m the main problem in this country the easily access to guns um gun fighting is getting worse and worse every year
most_important_problem_638827d8177891e7d70519f8,The most biggest problem is racism and immigrants.,True mold beggar's problem as race of em Heande um Emigrants,Tre most biggest problem is Raceism and um Emigrants,Tremont biggest problem is racism and immigrants,The country's biggest problem is racism and immigrants.,My biggest problem is racism and immigrants.,the country's biggest problem is racism and immigrants
political_trust_washington_5c264cc409440500015b5c76,I think the federal government is torn apart and sewn by corporations and so their best interest is to their donors and to their lobbyists and not to the Americans.,I think the fellow government is Bobotn Sould by Corperation and so their Bastager is to their a Doners and to their Lobiit ad not the American,I think the Federal Government is full of MI sold by corporations and so their best interest is to their a donors and to their lobbyist and not for the American,and to their lobbyists and not to be American,I think the federal government is bought and sold by corporations and so their best interest is to their donors and to their lobbyists and not to the Americans.,"I think the federal government is full of thought and sold by corporations, and so their best interest is to their donors and to their lobbyists and not to the Americans.",i think the federal government is bought bought and sold by corporations and so their best interest is to their donors and to their lobbyists and not to the american people
political_trust_washington_60ca846ffad77e5b1fee110a,A lot of corruption that goes in the legislation to trust them so that's why I put at.,But a corruption that goes on an Ourlegislation system so we that's why put Ou,A corruption tat goes on in our legislation system so that's war put,the corruption that goes on in this place and system play that's what I put on,a lot of corruption that goes on in the legislation system. So that's what I put out.,...a lot of corruption that goes on in the legislation system. So......that's what I put out.,there a lot of corruption goes on in the legislation system
political_trust_washington_60fce53eb9820b7477892ddd,They never follow through,They never Fallowed through,They never followed through,you never follow through,They never follow through.,They never follow through.,they never followed through
political_trust_washington_614e4d6c3ee9ec6679f47769,"I think a lot of policy is driven by money, and not the best interest of the citizens.",I think a lot of policy is driven by money and not the best interest of the citizens,I think a lot of policy is driven by money and not the best interest of the citizens,I think a lot of policy is driven by money and not the best interest of the citizens,I think a lot of policy is driven by money and not the best interest of the citizens.,I think a lot of policy is driven by money and not the best interest of the citizens.,i think a lot of policy is driven by money and not the best interest of the citizens
political_trust_washington_62989737409d018c733483c1,For the most part the the federal government does what's right by the people for the most part but then there's sometimes that they throw us for a loop or for a curveball and we're gonna have to look like whoa where did that come from? but yes most of the time I really do believe that the government does do what it is right by the American people.,For the most part of the the Federal Government does Whats rude by the people for the most part UT there sometimes Hey toes for a Luper fer Curbl On't have to look like wo Whetder that come from but yes most of the time I really do believe that the Governmort does do what it is right by the American people,For the most part we the Federal Government does what's right by the people for the most part but there's sometimes that Tey dos for a Goop or for a cur ball N have to look like wool where Dod that come from but yes most of the time I really do believe that the government does do what is right by the American people,for the most part federal government those woods Grapevine stupid people,"For the most part, the federal government does what's right by the people for the most part, but then there's sometimes that they throw us for a blooper for a curveball and we have to look like, whoa, where did that come from? But yes, most of the time, I really do believe that the government does do what is right by the American people.","For the most part, the federal government does what's right by the people for the most part, but then sometimes they throw us for a blooper, for a curveball, and I have to look like, whoa, where did that come from? But yes, most of the time, I really do believe that the government does do what is right by the American people.",for the most part the um the federal government does what's right by the people for the most part but then there's sometimes that they thou was for a loop or for a curve ball and i have to look like whoa where did that come from but yes most of the time i really do believe that the government does do what it's right by the american people
political_trust_washington_62ac97a08ab6bf8042c7cedf,I feel like there is a bunch of information that the federal government hasn´t shared with us and I don´t like being kept away from secrets.,I feel like there's a bunch of information dead the Federal Gu government hasn't share with us and Ow unlike being kept away from secrets,I feel like there's a bunch of information dead the Federal Government has it share with us and I don't like being kept away from secrets,I feel like there's a bunch of information that the federal government hasn't shared with us and I don't like being kept away from secrets,I feel like there's a bunch of information that the federal government hasn't shared with us and I don't like being kept away from secrets.,I feel like there's a bunch of information that the federal government hasn't shared with us and I don't like being kept away from secrets.,i feel like there's a bunch of information that the federal government hasn't shared with us and i don't like being kept away from secrets
political_trust_washington_6337b9604370dd57643b81a0,I think overall you could trust the government but there may be some things they're not sharing with us.,I think over all you can trust the government but there may be some things they're not sharing with us,I think over all you could trust the government but there may be some things they're not sharing with us,I think I brawl you can trust the government but there may be some things are not sharing with us,"I think overall you can trust the government, but there may be some things they're not sharing with us.","I think overall you can trust the government, but there may be some things they're not sharing with us.",i think overall you can trust the government but there may be some things they are not sharing with us
political_trust_washington_633f5252efab6885fedfad7d,I'm not a big fan of government.,I'm not a big Fround of government,I'm not a big found of government,I'm not a big fan of government,I'm not a big fan of the government.,I'm not a big fan of the government.,i'm not a big fan of the government
president_56b2f64c9b4875000b2099f2,"He's a terrible guy, but he's better than the other option.",He's a terrible guy but he's better than the other option he,He's a terrible guy but he's better than the other option,he's a terrible guy but he's better than the other option,"He's a terrible guy, but he's better than the other option.","He's a terrible guy, but he's better than the other option.",he's a terrible guy but he's better than the other option
president_5968334dd0464f0001981856,I like Joe Biden. I think he's got a good heart and he means to do well. However I do believe he is getting too old to handle the position of president.,I like Joobidan I think he's got a good heart and he means to do well however I do believe he is getting too old to handle the position of President,I like Joe Bidan I think he's got a good heart and he means to do well however I do believe he is getting too old to handle the position of President,I like Joe Biden I think he's got a good heart and I mean to do well however I do believe he's getting too old to handle the position of president,"I like Joe Biden. I think he's got a good heart and he means to do well. However, I do believe he is getting too old to handle the position of president.","I like Joe Biden. I think he's got a good heart and he means to do well. However, I do believe he is getting too old to handle the position of president.",i like joe biden i think he's got a good heart and he means to do well however i do believe he is getting too old to handle the position of president
president_5a50fab2f6c517000194760b,"Joe Biden was elected to bring some stability to the country and succeeded in doing that. I think he is doing an adequate job, he has brought in some good things but as perhaps reached a little too far in some of his ambitions.",Providon was Electic Inrecensibility to a to the country and succeeded in doing that I think he is doing an adequate job he thought it some good things but Ah has perhaps reached a little too far in some of his ambitions,Obyden was elected in recent stability to a to the country and succeeded in doing that I think he is doing an adequate job he's brought in some good things but Ah has perhaps reached a little too far in some of his ambitions,Joe Biden was elected to the country and succeeded in doing that I think she is doing an adequate job he's got in some good things got a little too far and some of his ambitions,"Joe Biden was elected to bring some stability to the country and succeeded in doing that. I think he is doing an adequate job. He's brought in some good things, but has perhaps reached a little too far in some of his ambitions.","Biden was elected to increase his stability to the country and succeeded in doing that. I think he is doing an adequate job. He's brought in some good things, but has perhaps reached a little too far in some of his ambitions. I think he's brought in some good things, but has perhaps reached a little too far in some of his ambitions. I think he's brought in some good things, but has perhaps reached a little too far in",biden was elected in recent stability to ah to the country and succeeded in doing that i think he is doing an adequate job he's brought in some good things but has perhaps reached a little too far in some of his ambitions
president_5ff5f7ad932d56101bf7c90d,He wasn't my first choice but he is certainly better than the alternative Republican candidate. I like most of his policies I think he's been able to get an amazing amount of done an amazing amount of stuff done with an extremely slim minority and I'm interested to see what happens the next couple years.,He wasn't my first choice but he's certainly better than the alternative Republican candidate Ah I like most of his policies I think he's been able to get an amazing amount of done an amazing amount of stuff done with a an extremely slim minority Ah and I'm interested to see what happens the next Coupliers,He wasn't my first choice but he's certainly better than the alternative Republican candidate I like most of his policies I think he's been able to get an amazing amount of done an amazing amount of stuff done with an extremely slim minority and I'm interested to see what happens the next couple of years,he wasn't my first choice but he's certainly better than the alternative Republican candidate I like most of his policies I think he's been able to get an amazing amount of done an amazing amount of stuff done with an extremely slim minority and I'm interested to see what happens the next couple years,"He wasn't my first choice, but he's certainly better than the alternative Republican candidate. I like most of his policies. I think he's been able to get an amazing amount of done, an amazing amount of stuff done with an extremely slim minority. And I'm interested to see what happens the next couple of years.","He wasn't my first choice, but he's certainly better than the alternative Republican candidate. I like most of his policies. I think he's been able to get an amazing amount of stuff done with an extremely slim minority, and I'm interested to see what happens the next couple years.",he wasn't my first choice but he's certainly better than the alternative republican candidate um i like most of his policies i think he's been able to get an amazing amount of done an amazing amount of stuff done with um an extremely slim minority um and i'm interested to see what happens the next couple of years
president_60e93525447d5e9ac6ebbd55,"I don´t really like him that much because i feel like he doesn´t always make the best decisions, and I also just feel like, sometimes he just doesn´t seem like he knows what he is doing.",Um I don't ROL Yo like him not much because I Fe like he doesn't always make the best decisions an I also just feel like sometimes he jest doesn't seem like he knows what he's doing,Oh I don't Welo like him not much because I feel like he doesn't always make the best decisions and I also just feel like sometimes he just doesn't seem like he knows what he's doing,I don't really like that much because I feel like he doesn't always make the best decisions and I also just feel like sometimes he just doesn't seem like he knows what you doing,"Um, I don't really like him that much because I feel like he doesn't always make the best decisions and I also just feel like sometimes he just doesn't seem like he knows what he's doing.","Um, I don't really like him that much because I feel like he doesn't always make the best decisions and I also just feel like sometimes he just doesn't seem like he knows what he's doing.",um i don't really like him that much because i feel like he doesn't always make the best decisions and i also just feel like sometimes he just doesn't seem like he knows what he's doing
president_60ef14df0e4b2fd0932b452f,"I don't think he was the best candidate, but I think he's doing a decent job.",I don't think he was the best candidate but I think he's doing a decent job,I don't think he was the best candidate but I think he's doing a decent job,I don't think he was the best candidate but I think he's doing a decent job,"I don't think he was the best candidate, but I think he's doing a decent job.","I don't think he was the best candidate, but I think he's doing a decent job.",i don't think he was the best candidate but i think he's doing a decent job
president_6151e479b4ee16668948c7f2,He's okay. A regular guy.,Es O K erect our Agu,Es O K Aright your GY,he's okay regular guy,"He's okay. All right, you're a guy.",He's okay. He's a regular guy.,he's okay a regular guy
president_629534afc0924e49e1464589,He's not the strongest president and there have been many disasters but I think he's doing just fine based on his credentials and abilities.,He's not the Stronget president and there have been Manusaucters but I think Heis doing just fine beast on his Credanshols and abilities,He's not the strongest president and there have been many disasters but I think he's doing just fine based on his credentials and abilities,he's not the strongest president and there have been many sisters but I think he's doing just fine based on his credentials and abilities,"He's not the strongest president and there have been many disasters, but I think he's doing just fine based on his credentials and abilities.","He's not the strongest president and there have been many disasters, but I think he's doing just fine based on his credentials and abilities.",he's not the strongest president and there have been many disasters but i think he's doing just fine based on his credentials and abilities
president_638427b0fd880d6b2a428a20,I think Joe Biden has done a great job as the president. I think he was facing a lot of adversity. When he came into office he's had a lot to have to deal with but I've been happy with the direction that he has led our country so far.,I think Jogiden has done a great job as the President I think he was facing a lot of adversity when he came into office he's had a lot too um have to deal with but I've been happy with the direction that he has led our country um so far,I think Joe Gaden has done a great job as the President I think he was facing a lot of adversity when he came into office he's had a lot to um have to deal with but I've been happy with the direction that he has led our country so far,I think Joe Biden has done a great job as the president I think he was facing a lot of adversity when he came into office he's had a lot to have to deal with but I've been happy with the direction that he has led our country so far,"I think Joe Biden has done a great job as the president. I think he was facing a lot of adversity when he came into office. He's had a lot to have to deal with, but I've been happy with the direction that he has led our country so far.","I think Joe Biden has done a great job as the president. I think he was facing a lot of adversity when he came into office. He's had a lot to have to deal with, but I've been happy with the direction that he has led our country so far.",i think joe biden has done a great job as the president i think he was facing a lot of adversity when he came into office he's had a lot to um have to deal with but i've been happy with the direction that he has led our country um so far
president_638827d8177891e7d70519f8,He is a very bad president and and he doesn't speak up on his ideas and he does not have good views.,He is a very bad present and he doesn't speak upon his ideas and he does not have good a view,He is a very bad president and he doesn't speak upon his ideas and he does not have good views,he is a very bad president and he doesn't speak up on his ideas and she does not have good view,He is a very bad president and he doesn't speak up on his ideas and he does not have good views.,He is a very bad president and he doesn't speak up on his ideas and he does not have good views.,speak up on his
president_638a66471585cb7583285740,Generally favorable just trying to do his best given the circumstances. There's a lot happening right now that he has to deal with but I do generally have respect for the guy.,Generally favorable just don s Tarn to do his best Givin the circumstances um there's a Ligt happening right now that ye ask a Dealeth but I dig Generaly AV respect for the gay,Generally favorable just done he's trying to do his best given the circumstances um here's a lot happening right now that he has to deal with but I did generally have respect for the guy,Charlie is a verbal just trying to do is best given the circumstances there's a lot happening right now that he has to deal with but I did Joe never expect the guy,"Generally favorable, just trying to do his best given the circumstances. There's a lot happening right now that he has to deal with, but I did generally have respect for the guy.","Generally favorable, just trying to do his best given the circumstances. There's a lot happening right now that he has to deal with, but I did generally have respect for the guy.",generally favorable just trying to do his best given the circumstances um there's a lot happening right now that he has to deal with but i generally have respect for the guy
president_639fdcf5efa9e98ed809d0df,I think he's doing a good enough job.,I think he's doin a good enough job,I think he's doin a good enough job,I think he's doing a good enough job,I think he's doing a good enough job.,I think he's doing a good enough job.,i think he's doing a good enough job
trust_most_people_586935b7e16d530001b34787,Most people are looking out for themselves because nobody else is gonna look out for them.,Most people are looking out for themselves because nobody else is goin look out for them,Most people are looking out for themselves because nobody else is going to look out for them,most people are looking out for themselves because nobody else is going to look out for them,Most people are looking out for themselves because nobody else is going to look out for them.,Most people are looking out for themselves because nobody else is going to look out for them.,most people are looking out for themselves because nobody else is going to look out for them
trust_most_people_59d6b8f103203500011ace12,I selected the answer 6 because I think that most people can be trusted. It's rare that I come across someone who cannot be trusted and I think most people are trying to do the right thing.,Am I selected the answer six because I think that most people can be trusted am it's rare that I come across some one who cannot be trusted and I think most people are trying to do the right thing,Am I selected the answer six because I think that most people can be trusted um it's rare that I come across someone who cannot be trusted and I think most people are trying to do the right thing,I selected the answer 6 because I think that most people can be trusted it's rare that I come across someone who cannot be trusted and I think most people are trying to do the right thing,I selected the answer six because I think that most people can be trusted. It's rare that I come across someone who cannot be trusted and I think most people are trying to do the right thing.,I selected the answer six because I think that most people can be trusted. It's rare that I come across someone who cannot be trusted and I think most people are trying to do the right thing. Let me show you the right thing.,um i selected answer six because i think that most people can be trusted um it's rare that i come across someone who can not be trusted and i think most people are trying to do the right thing
