ID_participant_long,transcript_coder1_coder2_coder3,transcript_wav2vec_base,transcript_wav2vec_large,transcript_google,transcript_whisper,transcript_whisper_medium,transcript_nvidia_xxlarge
future_children_5ef764821269f404a08607d7,This is an easy one to answer. I'm 71. Biologically it would be very difficult to have a child.,This is an easy one to answer I'm seventy one biologically would be very difficult to have a CHIK,This is an easy one to answer I'm seventy one biologically it would be very difficult to have a,this is an easy one to answer I'm 71 biologically would be very difficult to have it,"This is an easy one to answer. I'm 71. Biologically, it would be very difficult to have a child.","This is an easy one to answer. I'm 71. Biologically, it would be very difficult to have a child.",this is an easy one to answer i'm seventy one biologically it would be very difficult to have a child
future_children_5f430d7837655454911d1d12,"Well, considering I'm 65 that's not gonna happen.",Well considering I'm sixty five that's not G to happen,Well considering I'm sixty five that's not going to happen,well considering I'm 65 that's not going to happen,"Well, considering I'm 65, that's not going to happen.","Well, considering I'm 65, that's not going to happen.",well considering i'm sixty five that's not going to happen
future_children_5fe49a4ad8918ba1615e298d,"First of all, I believe three children are enough. Secondly, I´m too old. I´m in my mid-50s and have gone through the changes, they say.",First of owl I Belave three children are enough Secondly I'm too old I I Ma mid Feties and Ive Gound Thoug the change as they say,First of all I believe three children are enough Secondly I'm too old my MI Fitis and I've gone through the change as they say,first of all of Olay three children are enough secondly I'm too old I'm in my mid-fifties and I've gone through the changes they say,"First of all, I believe three children are enough. Secondly, I'm too old. I'm in my mid-fifties and I've gone through the change, as they say.","First of all, I believe three children are enough. Secondly, I'm too old. I'm in my mid-50s and I've gone through the change, as they say.",first of all i believe three children are enough secondly i'm too old i'm in my mid fifties and have gone through the change as they say
future_children_6044dfc230e44b5793804ba6,I thought I already answered this. I'm not planning to have a child because I don't want a child. And I've never wanted a child. And people who don't want children shouldn't have them that's why.,I thought I already answered this I'm not planning to have a child because I don't want a child and I've never wanted a child and people who don't want children shouldn't have them that's why,I thought I already answered this I'm not planning to have a child because I don't want a child and I've never wanted a child and people who don't want children shouldn't have them that's why,I thought I already answered this I'm not planning to have a child because I don't want a child and I've never wanted a child and people who don't want children shouldn't have them that's why,I thought I already answered this. I'm not planning to have a child because I don't want a child. And I've never wanted a child. And people who don't want children shouldn't have them. That's why.,"I thought I already answered this. I'm not planning to have a child because I don't want a child. And I've never wanted a child. And people who don't want children shouldn't have them, that's why.",i thought i already answered this i'm not planning to have a child because i don't want a child and i've never wanted a child and people who don't want children shouldn't have them that's why
future_children_6101e26ce1c8ecd4461cc3e5,I'm not planning to have children the next two years because me and my husband's plan to have children might be in the next five years. We are still very young we are still trying to figure out our financials and our life goals so we want our childbearing to coincide with our goals long-term.,I'm not Playning to have children the next two years because me and my husband's plan to have children might be the next five years we are still very young we are still trying t figure out our financials in our life goals so we want our child bearing to coincide with our goal's long Tern,I am not planning to have children the next two years because me and my husbands Plannd to have children might be in the next five years we are still very young we are still trying to figure out our financials and our life goals so we want our child bearing to coincide with our goal's long term,I'm not planning to have children the next two years because me and my husband's plan to have children might be in the next five years we are still very young we are still trying to figure out our financials and our life goals so we want our childbearing to coincide with our goals long-term,"I'm not planning to have children the next two years because me and my husband's plan to have children might be in the next five years. We are still very young, we are still trying to figure out our financials and our life goals, so we want our childbearing to coincide with our goals long-term.","I'm not planning to have children the next two years because me and my husband's plan to have children might be in the next five years. We are still very young, we are still trying to figure out our financials and our life goals, so we want our childbearing to coincide with our goals long term.",i am not planning to have children the next two years because me and my husband's plan to have children might be in the next five years we are still very young we are trying to figure out our financials and our life goals so we want to coincide with our goals long term
future_children_6101ed07f939f9662014e6a1,Well I would just hope to have the money and have some of my life together that way I'll be able to support my kids.,Well I just hope to have the money am and am have some some my life together that Whale bill to support my kids,Well I just hope to have the money am and am have some some of my life together that way ill Bild to support my kids,well I just talked to how the money and have some of my life together that way I'll be able to support my kids,"Well, I just hope to have the money and have some of my life together. That way I'll be able to support my kids.","Well, I just hope to have the money and have some of my life together. That way I'll be able to support my kids.",well i just hope to have the money um and um have some some of my life together that way i'll be able to support my kids
future_children_6111a8e5c22c39a1c92edb70,Because I already have three kids and I also have a vasectomy so I can´t have any more.,Because already have three kids and I I also have OM of a sect me so I can't have any one,Because I already have three kids and a I also have a of a Sectme so I can't have any more,cuz I already have three kids and I also have a second so I can have anyone,"Because I already have three kids and I also have a vasectomy, so I can't have any more.",because I already have three kids and I also have a vasectomy so I can't have anymore.,because i already have three kids and i also have a busy so i can't have anymore
future_children_615252fe3ac6a44f68bdc779,Because I´m not in a relationship and I never wanna have kids.,Because I'm not in relationship and I never went Apkins,Because I'm not in a relationship and I never want to have kids,because I'm not in a relationship and I never asked you,Because I'm not in a relationship and I never want to have kids.,Because I'm not in a relationship and I never want to have kids.,because i am not in a relationship and never want to have kids
future_children_62cbf51439a76e8fccd8a495,I am past the point in my life where I can't have more children and I wouldn't want them. I'm content with the two that I have and I wouldn't have time to devote to another child the way I do to my family right now and I don't wanna take any attention off of anyone that's in my family now.,I am past the point my life where I can't have more children and I went and want them Im I'm content with the two that I have and I went and have time to devote to another child the way I due to my family ring now and I don't want to take any attention off of any one that's on my family now,I am past the point in my life where I can't have more children and I wouldn't want them a I'm content with the two that I have and I Wontt have time to devote to another child the way I do to my family right now and I don't want to take any attention off of any one that's in my family now,I am past the point in my life where I can't have more children and I didn't want them I'm content with the two that I have and I wouldn't have time to devote to another child the way I do to my family right now and I don't want to take any attention off of anyone that's in my family now,I am past the point in my life where I can't have more children and I wouldn't want them. I'm content with the two that I have and I wouldn't have time to devote to another child the way I do to my family right now. And I don't want to take any attention off of anyone that's in my family now.,I am past the point in my life where I can't have more children and I wouldn't want them. I'm content with the two that I have and I wouldn't have time to devote to another child the way I do to my family right now. I don't want to take any attention off of anyone that's in my family now.,i am past the point in my life where i can't have more children and i wouldn't want them um i'm content with the two that i have and i wouldn't have time to devote to another child the way i do to my family right now and i don't want to take any attention off of anyone that's in my family now
future_children_6337b9604370dd57643b81a0,Because I've always wanted to have kids and have a family,Because I've always wanted to have kids and have a family,Because I've always wanted to have kids and have a family,because I've always wanted to have kids and have a family,Because I've always wanted to have kids and have a family.,Because I've always wanted to have kids and have a family.,because i always wanted to have kids and have a family
future_children_636159dccb8ebae6099ab520,I am about to start psychiatry residency and will probably not have a lot of free time.,I am about to start Sechietry Residency and I will probably knock hat a Vall ot a free time,I am about to start psychiatry Residency and a will probably not have a lot of free time,I am about to start Psychiatry residency and will probably don't have a lot of free time,I am about to start psychiatry residency and will probably not have a lot of free time.,I am about to start psychiatry residency and will probably not have a lot of free time.,i am about to start psychiatristy residency and uh will probably not have a lot of free time
future_children_637e447c16e05f6828930612,I'm not having another child because I am 67 years old and my wife is 66 years old. Be a little difficult.,Non having another child Maccouns Im sixty seven years old an Mawaf I sixty six Yearso me little difficult,I'm not having another child because I am sixty seven years old and my wife is sixty six years old be a little difficult,I'm having another child because I'm 67 years old and my wife is 66 years old be a little difficult,I'm not having another child because I am 67 years old and my wife is 66 years old. It may be a little difficult.,I'm not having another child because I'm 67 years old and my wife is 66 years old. It's a little difficult.,am not having another child because i am sixty ⁇ seven years old and my wife is sixty ⁇ six years old be a little difficult
future_children_6387f4bcdf5c22093c240bf6,I'm not planning to have a kid because I'm 55 years old and about 8 years into menopause. So I will not have one. Yay,Not Playin to have a kid Becauseim fifty five years old an about eight years Inte Menapaws so I will not have one Yea,Not Playin to have a kid because I'm fifty five years old and about eight years in the Minipaus so I will not have one Yea,not playing to have a kid because I'm 55 years old in about eight years in the menopause so I will not have one yet,I'm not planning to have a kid because I'm 55 years old and about 8 years into menopause. So I will not have one. Yay!,I'm not planning to have a kid because I'm 55 years old and about 8 years into menopause. So I will not have one. Yay.,not playing to have a kid because i'm fifty five years old and about eight years into menopause so i will not have one yea
future_children_63b75c4505aa30e817d4f53f,I'm just too old now to have any more children. 63,I'm just too old now to have any more children sixty three,I'm just too old now to have any more children sixty three,I'm just too old now to have any more children 63,I'm just too old now to have any more children. 63!,I'm just too old now to have any more children. 63!,i'm just too old now to have any more children sixty three
life_satisfaction_5bc4ff222c08740001316ed2,I don't make as much money as I would like to.,I don't make as much money as I would like to,I don't make as much money as I would like to,I don't make as much money as I would like to,I don't make as much money as I would like to.,I don't make as much money as I would like to.,i don't make as much money as i would like to
life_satisfaction_60ca846ffad77e5b1fee110a,I have a lot to be thankful for but I'm not where I am. I'm not where I want to be in life right now.,Tell him I have a lot to be thankful for but I'm not Waring in I'm not ware I want to be in Lyfran now,Elem I have a lot to be thankful for but I'm not where I am I'm not where I want to be in life right now,oh my have a lot to be thankful for but I'm not where I am and I'm not where I want to be in life right now,"I have a lot to be thankful for, but I'm not where I am. I'm not where I want to be in life right now.","Um, I have a lot to be thankful for, but I'm not where I am. I'm not where I want to be in life right now.",i have a lot to be thankful for but i'm not where i am not where i want to be in life right now
life_satisfaction_60fe095a27a19c4dc0eb5e0e,Not gonna lie these days life isn't easy. Especially with having 4 kids everything is so expensive. The world just feels like it's going to hell so it just doesn't feel like I'm at peace.,Not UN TA lie these days life isn't easy am especially with having Forkids everything is so expensive am the world just feels like it's going to hell so it just doesn't feel like I'm at peace,Not going to lie these days life isn't easy am especially with having poor kids everything is so expensive a the world just feels like it's going to hell so it just doesn't feel like I'm at peace,black and white these days life is a c especially with having 4 Kids everything is so expensive the world just feels like it's going to hell so it doesn't feel like I'm at peace,"I'm not gonna lie, these days life isn't easy. Especially with having poor kids, everything is so expensive. The world just feels like it's going to hell. So it just doesn't feel like I'm at peace.","I'm not gonna lie, these days life isn't easy. Especially with having four kids, everything is so expensive. The world just feels like it's going to hell. So, it just doesn't feel like I'm at peace.",i'm not going to lie these days life isn't easy um especially with having four kids everything is so expensive um the world just feels like it's going to hell so it just doesn't feel like i'm at peace
life_satisfaction_6150fb8383f88eae3e5c795a,"I'm moderately satisfied because I have a house, a wife, kids I love. Could just use more money sometimes. Other than that everything's good.",I'm moderately satisfied because I've a house a wife kids I love could just use more money sometimes earning that everything's good,I'm moderately satisfied because I have a house a wife kids I love could just use more money sometimes other than that everything's good,I'm moderately satisfied because I have a house wife kids I love could just use more money sometimes other than that everything's good,"I'm moderately satisfied because I have a house, a wife, kids I love. I could just use more money sometimes. Other than that, everything's good.","I'm moderately satisfied because I have a house, a wife, kids I love. Could just use more money sometimes. Other than that, everything's good.",i'm moderately satisfied because i've a house a wife kids i love could just use more money sometimes other than that everything's good
life_satisfaction_62728d9afbb36631896f3bcb,I have a good stable job and so does my girlfriend. Our kids are healthy and our house is paid for. We have plenty of money in the bank so things are good.,Have a good stable job and so does my girl friend our kids are healthy and a our house is paid for we have plenty O money in the Bank so a things are good,Have a good stable job and so does my girl friend our kids are healthy and our house is paid for we have plenty of money in the Bank so things are good,have a good stable job and so does my girlfriend kids are healthy and house is paid for we have plenty of money in the bank so things are good,I have a good stable job and so does my girlfriend. Our kids are healthy and our house is paid for. We have plenty of money in the bank. So things are good.,I have a good stable job and so does my girlfriend. Our kids are healthy and our house is paid for. We have plenty of money in the bank. So things are good.,i have a good stable job and so does my girlfriend our kids are healthy and our house is paid for we have plenty of money in the bank so things are good
life_satisfaction_62914c34e831fee715303be6,Because I do feel things could be better comma I know they could be a whole lot worse,Because I do feel things could be better Camma I know they could be a whole lot worse,Because I do feel things could be better Tomma I know they could be a whole lot worse,"because I do feel things could be better, I know they could be a whole lot worse","Because I do feel things could be better, I know they could be a whole lot worse.","Because I do feel things could be better, I know they could be a whole lot worse.",because i do feel things could be better i know they could be a whole lot worse
life_satisfaction_638618fa9af1295309751c0c,The country is on a better track to become better. I'm retired now and have more time to be able to do things that I can enjoy.,The country is on a better track to become better I I'm retired now and have more time to be able to do things that I can enjoy,The country's on a better track to become better I'm retired now and have more time to be able to do things that I can enjoy,the countries on a better track to become better I'm retired now and have more time to be able to do things that I can enjoy,The country is on a better track to become better. I'm retired now and have more time to be able to do things that I can enjoy.,The country is on a better track to become better. I'm retired now and have more time to be able to do things that I can enjoy.,the country's on a better track to become better i'm retired now and have more time to be able to do things that i can enjoy
life_satisfaction_638827d8177891e7d70519f8,Tough time trying to get myself together and I feel like if I get a job and pass high school I´ll be very satisfied.,Of time trying go myself together Oh I fee like if I get a Jobby and pass high school I'll be very satisfied,Rouh time try O go myself together Oh a Ter like if I get a job Eand pass high school I'll be very satisfied,sometimes I get myself together I feel like if I get a job yet passed high school I'll be very satisfied,"Tough time trying to get myself together. Um, I feel like if I get a job being past high school, I'll be very satisfied.","Tough time trying to get myself together. I feel like if I get a job, we had passed high school, I'll be very satisfied.",tough time trying to get myself together um i feel like if i get a job even past high school i'll be very satisfied
life_satisfaction_639fdcf5efa9e98ed809d0df,I am retired and I don't have to work and have enough money to live on,I am retired and I don't have to work and have enough money to live on,I am retired and I don't have to work and have enough money to live on,I am retired and I don't have to work and have enough money to live on,I am retired and I don't have to work and have enough money to live on.,I am retired and I don't have to work and have enough money to live on.,i'm retired and i don't have to work and have enough money to live on
life_satisfaction_63b4ccbc2fc0eac107d7e273,Because even though there are always things that could change and improve I feel content with my life where I am.,Because even though there are always things that could change and improve I feel content with my life where I am,Because even though there are always things that could change and improve I feel content with my life where I am,because even though there are always things that could change and improve I feel content with my life where I am,"Because even though there are always things that could change and improve, I feel content with my life where I am.","Because even though there are always things that could change and improve, I feel content with my life where I am.",because even though there are always things that could change and improve i feel content with my life where i am
most_important_problem_5bc4ff222c08740001316ed2,Climate change,Climar change,Climate change,climate change,Climate change.,Climate change.,climate change
most_important_problem_60fb4917318c63922d387555,"I would say helping other countries before ourselves. After a while, we might be broke.",I would say Happing on the Cottrige before ourselves after one we might be Bronk,I would say Helpin other countries before themselves after while we might be broke,I would say helping all the countries with what are cells after why we might be broke,"I would say helping other countries with water sales. After a while, we might be broke.",I would say helping other countries before themselves. After a while we might be broke.,i would see helping other countries before themselves after a while we might be broke
most_important_problem_60fdd635d896e5b5e23bd88c,"The biggest problem in this country is the divisiveness they country is too divided politically, racially and we all need to just come together.",The biggest problem in this country is the Dum the Devisiveness Ah the country is too divided politically racially and we all need to just come together,The biggest problem in this country is the um the Devisiveness Ah the country is too divided politically racially and we all need to just come together,the biggest problem in this country is the the divisiveness the country is too divided politically racially and we all need to just come together,"The biggest problem in this country is the divisiveness. The country is too divided politically, racially, and we all need to just come together.","The biggest problem in this country is the divisiveness. The country is too divided politically, racially, and we all need to just come together.",the biggest problem in this country is the um the divisiveness the country is too divided politically racially and we all need to just come together
most_important_problem_6119efd15a0a464b68fd0c6e,I think the most important problem facing this country could be possible war.,I think the most important problem face in this country could be possible war,I think the most important problem face in this country could be possible war,I think the most important problem facing this country could be possible War,I think the most important problem facing this country could be possible war.,I think the most important problem facing this country could be possible war.,i think the most important problem facing this country could be possible war
most_important_problem_62978b42ddbf6894c660de15,"This country, as in the United States, I would say violence.",This country as in the United States I would say violence,This country as in the United States I would say violence,this country as in the United States I would say violence,"this country as in the United States, I would say violence.","This country, as in the United States, I would say violence.",this country as in the united states i would say violence
